{
  "schema_version": "scene-canon-asset-manifest.v1",
  "package_id": "SCENE_ID_ASSET_PACK_V1",
  "scene_id": "SCENE_ID",
  "canon_revision": "canon-v1",
  "canon_sha256": "0000000000000000000000000000000000000000000000000000000000000000",
  "appearance_revision": "appearance-v1",
  "appearance_sha256": "0000000000000000000000000000000000000000000000000000000000000000",
  "completion_hash": "0000000000000000000000000000000000000000000000000000000000000000",
  "package_status": "draft",
  "task_finalization_status": "not_started",
  "assistant_qa_status": "not_reviewed",
  "production_approval_status": "not_granted",
  "scene_canon_path": "00_manifest/SCENE_CANON.json",
  "appearance_decomposition_path": "00_manifest/SOURCE_APPEARANCE_DECOMPOSITION.json",
  "assets": [
    {
      "asset_id": "CDM_001",
      "asset_name": "Canonical Diagnostic Master",
      "asset_type": "canonical_diagnostic_master",
      "asset_revision": 1,
      "file_path": "02_diagnostic_master/canonical_diagnostic_master.png",
      "file_sha256": null,
      "is_machine_asset": true,
      "independently_generated": true,
      "derived_from_multipanel": false,
      "generation_mode": "independent_full_frame",
      "terminal_generation_call": "not_started",
      "generation_turn": null,
      "inspection_turn": null,
      "generation_status": "planned",
      "assistant_qa_status": "not_reviewed",
      "production_approval_status": "not_granted",
      "actual_pixel_dimensions": {"width": 1, "height": 1},
      "actual_dimensions_verified": false,
      "target_pixel_dimensions": {"width": 3840, "height": 2160},
      "native_4k_claim": false,
      "native_4k_evidence": null,
      "source_reference_ids": ["SRC_001"],
      "canon_sha256": "0000000000000000000000000000000000000000000000000000000000000000",
      "appearance_sha256": "0000000000000000000000000000000000000000000000000000000000000000",
      "completion_hash": "0000000000000000000000000000000000000000000000000000000000000000",
      "scene_canon_version": "draft",
      "neutral_appearance_version": "draft",
      "contamination_flags": {"text_or_layout": false, "person": false, "product": false, "temporary_object": false, "look_contamination": false},
      "four_k_prompt_id": null
    },
    {
      "asset_id": "SRM_001",
      "asset_name": "Spatial Relational Master",
      "asset_type": "spatial_relational_master",
      "asset_revision": 1,
      "file_path": "03_spatial_relational_master/spatial_or_relational_master.png",
      "file_sha256": null,
      "is_machine_asset": true,
      "independently_generated": true,
      "derived_from_multipanel": false,
      "generation_mode": "independent_full_frame",
      "terminal_generation_call": "not_started",
      "generation_turn": null,
      "inspection_turn": null,
      "generation_status": "planned",
      "assistant_qa_status": "not_reviewed",
      "production_approval_status": "not_granted",
      "actual_pixel_dimensions": {"width": 1, "height": 1},
      "actual_dimensions_verified": false,
      "target_pixel_dimensions": {"width": 3840, "height": 2160},
      "native_4k_claim": false,
      "native_4k_evidence": null,
      "source_reference_ids": ["SRC_001"],
      "canon_sha256": "0000000000000000000000000000000000000000000000000000000000000000",
      "appearance_sha256": "0000000000000000000000000000000000000000000000000000000000000000",
      "completion_hash": "0000000000000000000000000000000000000000000000000000000000000000",
      "scene_canon_version": "draft",
      "neutral_appearance_version": "draft",
      "contamination_flags": {"text_or_layout": false, "person": false, "product": false, "temporary_object": false, "look_contamination": false},
      "four_k_prompt_id": null
    }
  ],
  "four_k_prompt_records": [],
  "approved_machine_asset_count": 0,
  "four_k_prompt_mapping_count": 0,
  "human_review_overview_board": null,
  "repair_log": [],
  "qa_report_path": "09_qa/QA_REPORT.md",
  "look_contamination_report_path": "09_qa/look_contamination_report.md",
  "four_k_prompt_mapping_report_path": "09_qa/4k_prompt_mapping_report.md"
}
